{
  "schema_version": "0.1.0",
  "patient_state": {
    "state_id": "synthetic-state-1",
    "revision": 1,
    "encounter_id": "synthetic-encounter-1",
    "language": "zh-CN",
    "sources": [
      {
        "source_id": "s1",
        "kind": "synthetic",
        "text": "患者右眼模糊三个月。"
      }
    ],
    "facts": []
  },
  "tasks": [
    "laterality",
    "photopsia",
    "floaters"
  ],
  "cloud_fallback_requested": false
}
